{"schema_version":"1.0.0-fixture","fixture":true,"operational":false,"repositories":[{"name":"setoxxx/nycif-field-desk","role":"GodView V2 frontend preview","branch":"feature/godview-v2-preview","ci":"PENDING","authority":"PREVIEW_ONLY","visibility":"public","status":"IN_PROGRESS","url":"https://github.com/setoxxx/nycif-field-desk"},{"name":"setoxxx/nycif-live-feeds","role":"Future sanitized GodView status snapshots","branch":"main","ci":"UNKNOWN","authority":"NOT_YET_IMPLEMENTED","visibility":"public","status":"PLANNED","url":"https://github.com/setoxxx/nycif-live-feeds"}]}